{
  "$schema": "https://json-schema.org/draft/2020-12/schema",
  "$id": "https://hub.accentcms.dev/schema/index.schema.json",
  "title": "Discovery index (<kind>s/index.json)",
  "description": "The machine-checkable form of m053 section 6.2. The index carries no download URL and no checksum, so it can never decide what bytes install -- but latest_version and versions decide which version an unpinned install resolves to, which is why it is signed. The root validates shape alone; a validator selects #/$defs/submitted or #/$defs/published (section 6.7). An index is a generated artifact: the validator regenerates it from the manifests and fails if the committed file disagrees.",
  "$ref": "#/$defs/base",
  "$defs": {
    "base": {
      "type": "object",
      "additionalProperties": false,
      "required": ["contract_version", "kind", "generated_at", "entries"],
      "properties": {
        "contract_version": { "const": 2 },
        "kind": {
          "description": "The kind this index lists; must match the directory.",
          "enum": ["plugin", "theme", "template"]
        },
        "generated_at": { "$ref": "#/$defs/timestamp" },
        "index_signature": {
          "description": "Registry signature over the whole index. Written by CI at merge, never by the submitter.",
          "$ref": "#/$defs/jws"
        },
        "entries": {
          "type": "array",
          "items": { "$ref": "#/$defs/entry" }
        }
      }
    },
    "submitted": {
      "description": "A submission: the registry holds the signing key, so index_signature is forbidden.",
      "allOf": [{ "$ref": "#/$defs/base" }],
      "not": { "required": ["index_signature"] }
    },
    "published": {
      "description": "The merged tree: CI has stamped the signature.",
      "allOf": [{ "$ref": "#/$defs/base" }],
      "required": ["index_signature"]
    },
    "entry": {
      "description": "One listed artifact. The generator owns everything derived from the manifests -- trust, author, pricing, versions, latest_version, updated_at -- and preserves the catalog fields, which describe the entry rather than any one version and have no other home in the layout.",
      "type": "object",
      "additionalProperties": false,
      "required": [
        "name",
        "description",
        "author",
        "license",
        "repository",
        "trust",
        "pricing",
        "latest_version",
        "versions",
        "updated_at"
      ],
      "properties": {
        "name": {
          "description": "Kebab-case identifier, unique within the kind.",
          "$ref": "#/$defs/name"
        },
        "description": {
          "description": "One line.",
          "type": "string",
          "minLength": 1,
          "maxLength": 160
        },
        "author": {
          "description": "Handle resolving to authors/<handle>.json.",
          "$ref": "#/$defs/handle"
        },
        "license": {
          "description": "SPDX identifier, or Proprietary for a commercial artifact.",
          "type": "string",
          "minLength": 1
        },
        "repository": {
          "description": "The source repository -- external and third-party-owned in the normal case, because the hub indexes rather than hosts. Every URL an entry sends a user to for bytes must be under the same owner as this one. That makes it the one carried-over entry field that decides something: repointing it is answered by rejecting the edit, since the manifests it is checked against are immutable once published.",
          "$ref": "#/$defs/https_url"
        },
        "homepage": { "$ref": "#/$defs/https_url" },
        "trust": { "enum": ["official", "verified", "community"] },
        "pricing": {
          "type": "object",
          "additionalProperties": false,
          "required": ["model"],
          "properties": {
            "model": { "enum": ["free", "commercial"] },
            "purchase_url": { "$ref": "#/$defs/https_url" },
            "seller": { "enum": ["vendor", "accentx"] }
          }
        },
        "latest_version": {
          "description": "Must appear in versions and must not be yanked.",
          "$ref": "#/$defs/semver"
        },
        "versions": {
          "description": "All published versions, oldest first, including yanked ones.",
          "type": "array",
          "minItems": 1,
          "uniqueItems": true,
          "items": { "$ref": "#/$defs/semver" }
        },
        "tags": {
          "description": "Lowercase, for search and filtering.",
          "type": "array",
          "uniqueItems": true,
          "items": { "type": "string", "pattern": "^[a-z0-9]+(-[a-z0-9]+)*$" }
        },
        "screenshots": {
          "description": "Themes and templates; rendered by the hub.",
          "type": "array",
          "items": { "$ref": "#/$defs/https_url" }
        },
        "updated_at": {
          "description": "Drives the hub's staleness display.",
          "$ref": "#/$defs/timestamp"
        }
      }
    },
    "name": {
      "type": "string",
      "pattern": "^[a-z0-9]+(-[a-z0-9]+)*$"
    },
    "handle": {
      "type": "string",
      "pattern": "^[a-z0-9]+(-[a-z0-9]+)*$"
    },
    "semver": {
      "type": "string",
      "pattern": "^(0|[1-9][0-9]*)[.](0|[1-9][0-9]*)[.](0|[1-9][0-9]*)(-((0|[1-9][0-9]*|[0-9]*[a-zA-Z-][0-9a-zA-Z-]*)([.](0|[1-9][0-9]*|[0-9]*[a-zA-Z-][0-9a-zA-Z-]*))*))?([+]([0-9a-zA-Z-]+([.][0-9a-zA-Z-]+)*))?$"
    },
    "https_url": {
      "type": "string",
      "pattern": "^https://[^\\s]+$"
    },
    "timestamp": {
      "type": "string",
      "pattern": "^[0-9]{4}-[0-9]{2}-[0-9]{2}T[0-9]{2}:[0-9]{2}:[0-9]{2}([.][0-9]+)?(Z|[+-][0-9]{2}:[0-9]{2})$"
    },
    "jws": {
      "type": "string",
      "pattern": "^[A-Za-z0-9_-]+[.][A-Za-z0-9_-]*[.][A-Za-z0-9_-]+$"
    }
  }
}
