{
  "contract_version": 2,
  "entries": [
    {
      "author": "accentx",
      "description": "Minimal starter project with home, blog and events sections.",
      "homepage": "https://accentcms.dev",
      "latest_version": "1.0.0",
      "license": "MIT",
      "name": "starter-site",
      "pricing": {
        "model": "free"
      },
      "repository": "https://github.com/AccentCMS/template-starter-site",
      "tags": [
        "starter",
        "blog",
        "minimal"
      ],
      "trust": "official",
      "updated_at": "2026-08-10T17:04:20Z",
      "versions": [
        "1.0.0"
      ]
    }
  ],
  "generated_at": "2026-08-10T22:24:52Z",
  "kind": "template"
}
