{
  "contract_version": 2,
  "entries": [],
  "generated_at": "2026-08-09T00:00:00Z",
  "index_signature": "eyJ0eXAiOiJKV1QiLCJhbGciOiJFZERTQSJ9.eyJkb2MiOiI3MjA5ZmIyMDI3YzEyYjJkNDM3NzU4NjcyYmVhM2I5NjU3Y2ZhOWZhNjJkZjMzMDFkOTU4ZDE0NWQ5YTc3MjRkIn0.MCe78pLpgRIhif8Ql_onaptwdQCgl6ZznS4A4dB0tBvcznFUDnKb8ZjI0l5aLamyAI4waRnUs8jHAWOgXqcTDw",
  "kind": "theme"
}
