{
  "contract_version": 2,
  "entries": [
    {
      "author": "accentx",
      "description": "Contact form with CSRF protection and SMTP delivery.",
      "homepage": "https://accentcms.dev",
      "latest_version": "0.3.0",
      "license": "MIT",
      "name": "accent-contact",
      "pricing": {
        "model": "free"
      },
      "repository": "https://github.com/AccentCMS/accent-contact",
      "tags": [
        "contact",
        "forms",
        "email",
        "smtp",
        "islands"
      ],
      "trust": "official",
      "updated_at": "2026-09-06T13:03:16Z",
      "versions": [
        "0.1.0",
        "0.2.0",
        "0.3.0"
      ]
    },
    {
      "author": "accentx",
      "description": "Tags and summarises pages with an LLM provider of your choosing.",
      "homepage": "https://accentcms.dev",
      "latest_version": "0.2.1",
      "license": "MIT",
      "name": "llm-tagging",
      "pricing": {
        "model": "free"
      },
      "repository": "https://github.com/AccentCMS/llm-tagging",
      "tags": [
        "ai",
        "llm",
        "tagging",
        "metadata",
        "content"
      ],
      "trust": "official",
      "updated_at": "2026-09-25T06:04:50Z",
      "versions": [
        "0.1.0",
        "0.2.0",
        "0.2.1"
      ]
    }
  ],
  "generated_at": "2026-09-25T06:07:22Z",
  "index_signature": "eyJ0eXAiOiJKV1QiLCJhbGciOiJFZERTQSJ9.eyJkb2MiOiJjMGNhMTIwODdmYjI5NmU2MTliYzhhZDliMjA4YzljNzZjYWY2NTczMDRkYzEwNzc4YzU3ZTAwMTk4ZTRhZWNmIn0.pUygNhZmYRvdo_vzfVSEhzochqrJ7ibQDvvymZOJa8zyKp8KNadAk_9CzvPNfHqrB4u8oICiUYyjSeKuyYy9BQ",
  "kind": "plugin"
}
